{
  "$schema": "https://json-schema.org/draft/2020-12/schema",
  "$id": "https://dice-skirmish.local/schema/face.schema.json",
  "title": "FaceCardDefinition",
  "description": "One face-card JSON document (src/server/content/faces/<face-id>.json). Several physical die slots may point at the same face (1:N). Overloads attach to the face card, not a slot. Synthetic faces are named specials only — never blank face-synthetic-<attr> generics.",
  "type": "object",
  "additionalProperties": false,
  "required": ["id", "name", "kind", "symbol", "rulesText", "onRoll", "onAbsorb", "maxOverloads", "forgeRestriction"],
  "properties": {
    "$schema": { "type": "string" },
    "id": { "$ref": "defs.schema.json#/$defs/faceId" },
    "name": { "type": "string", "minLength": 1 },
    "kind": { "$ref": "defs.schema.json#/$defs/faceKind" },
    "symbol": {
      "description": "Attribute this face produces, or shield for the untyped starting face.",
      "$ref": "defs.schema.json#/$defs/symbolType"
    },
    "technique": {
      "description": "Combat toolkit while showing (spec 028). Identity naturals omit this. Distinct from faceType (spec 029).",
      "$ref": "defs.schema.json#/$defs/technique"
    },
    "faceType": {
      "description": "Named-action type (spec 029). No inherent damage. Omit on legacy faces.",
      "$ref": "defs.schema.json#/$defs/faceType"
    },
    "primaryEffects": {
      "description": "Resolved alone via USE_FACE (spec 029). Empty / omit = not usable as a simple action.",
      "type": "array",
      "items": { "$ref": "effect.schema.json#/$defs/effect" }
    },
    "secondaryEffects": {
      "description": "Applied when this face is the secondary of a Fighter technique (spec 029). next-attack-bonus here = local technique damage bonus.",
      "type": "array",
      "items": { "$ref": "effect.schema.json#/$defs/effect" }
    },
    "sequenceRole": {
      "description": "Spec 030. When set, USE_FACE opens the reaction chain and follows Open / Combo / Finish. Omit for immediate spec 029 resolution.",
      "$ref": "defs.schema.json#/$defs/sequenceRole"
    },
    "meterCost": {
      "description": "Spec 030. Spent when a sequence-role simple move conducts. Checked at declare.",
      "type": "integer",
      "minimum": 0
    },
    "meterGain": {
      "description": "Spec 030. Granted when a sequence-role simple move conducts, after meterCost. Not a generation formula.",
      "type": "integer",
      "minimum": 0
    },
    "rulesText": {
      "type": "string",
      "description": "English inherent-effect region. Empty on identity faces (+1 Attribute is the footer, not rules text). Dual-timing faces use On roll: / On absorb: prefixes."
    },
    "onRoll": {
      "description": "Fired when this face is showing after a roll (bible §14). Empty until every printed On-roll clause is modelled. Legacy type members or AST op nodes.",
      "type": "array",
      "items": { "$ref": "effect.schema.json#/$defs/effect" }
    },
    "onAbsorb": {
      "description": "Fired when a symbol produced by a die showing this face is absorbed. Empty until On-absorb print is wired. On-absorb is retired as a face design axis (spec 025); leave empty on new faces.",
      "type": "array",
      "items": { "$ref": "effect.schema.json#/$defs/effect" }
    },
    "pips": {
      "$ref": "defs.schema.json#/$defs/symbolTokens",
      "description": "Inherent yield when rolled, e.g. { \"mechanical\": 2 } or { \"luminar\": 1, \"mechanical\": 1 }. Omitted = one pip of symbol. Spec 025. Not a Generate opcode."
    },
    "convertRoll": {
      "type": "boolean",
      "description": "If true, On roll opens Choose one: bank this die's pips, or the printed onRoll payoff and do not bank (spec 025)."
    },
    "whileShowing": {
      "type": "array",
      "description": "Continuous stance modifiers while this face is showing on an owned die (spec 025). Not StandingTrigger.",
      "items": { "$ref": "#/$defs/whileShowingModifier" }
    },
    "maxOverloads": {
      "type": "integer",
      "minimum": 0,
      "description": "Capacity for overloads attached to this face card (shared across all slots showing it)."
    },
    "forgeRestriction": {
      "description": "When echo-cards, only tactics tagged forgeTags: [echo] may install this face. null = no extra install gate.",
      "type": ["string", "null"],
      "enum": ["echo-cards", null]
    },
    "activated": {
      "description": "Player-activated face ability paid with ACTIVATE_FACE during the actions phase.",
      "$ref": "defs.schema.json#/$defs/faceActivatedAbility"
    },
    "stayPolicy": {
      "description": "Stay-on-slot while installed. Distinct from forgeRestriction (who may install this type).",
      "$ref": "defs.schema.json#/$defs/faceStayPolicy"
    },
    "pestilenceSpreadAt": {
      "type": "integer",
      "minimum": 1,
      "description": "Pestilent Plague: after this many counters on the physical slot, reset them and try to forge another copy onto an adjacent slot."
    }
  },
  "allOf": [
    {
      "if": {
        "properties": { "kind": { "const": "untyped" } },
        "required": ["kind"]
      },
      "then": {
        "properties": {
          "symbol": { "const": "shield" },
          "id": { "type": "string", "pattern": "^face-untyped-" },
          "pips": {
            "type": "object",
            "additionalProperties": false,
            "properties": {
              "shield": { "$ref": "defs.schema.json#/$defs/positiveAmount" }
            }
          },
          "convertRoll": { "const": false }
        }
      }
    },
    {
      "if": {
        "properties": { "kind": { "const": "natural" } },
        "required": ["kind"]
      },
      "then": {
        "properties": {
          "symbol": { "$ref": "defs.schema.json#/$defs/attribute" },
          "id": { "type": "string", "pattern": "^face-natural-" },
          "pips": { "$ref": "defs.schema.json#/$defs/attributeTokens" }
        }
      }
    },
    {
      "if": {
        "properties": { "kind": { "const": "synthetic" } },
        "required": ["kind"]
      },
      "then": {
        "properties": {
          "symbol": { "$ref": "defs.schema.json#/$defs/attribute" },
          "id": { "type": "string", "pattern": "^face-synthetic-" },
          "pips": { "$ref": "defs.schema.json#/$defs/attributeTokens" }
        }
      }
    }
  ],
  "$defs": {
    "whileShowingModifier": {
      "title": "WhileShowingModifier",
      "description": "Closed stance union while this face is showing (spec 025).",
      "type": "object",
      "additionalProperties": false,
      "required": ["type", "amount"],
      "properties": {
        "type": {
          "type": "string",
          "enum": ["pierce", "empower", "play-discount", "forge-discount", "reduce"]
        },
        "amount": { "type": "integer", "minimum": 1 }
      }
    }
  }
}
