{
  "$schema": "../schema/face.schema.json",
  "id": "face-synthetic-shadow-echo",
  "name": "Shadow Echo",
  "kind": "synthetic",
  "symbol": "darkness",
  "rulesText": "On roll: you may [Discard 1]; if you do, [Draw 1].\nOn absorb: [Recall 1] that costs 2 or less.",
  "onRoll": [
    {
      "type": "discard-cards",
      "amount": 1,
      "optional": true,
      "then": [
        {
          "type": "draw-cards",
          "amount": 1
        }
      ]
    }
  ],
  "onAbsorb": [
    {
      "type": "search-graveyard",
      "amount": 1,
      "maxPlayCost": 2
    }
  ],
  "maxOverloads": 2,
  "forgeRestriction": null
}
