{
  "$schema": "../schema/face.schema.json",
  "id": "face-synthetic-mainspring",
  "name": "Mainspring",
  "kind": "synthetic",
  "symbol": "mechanical",
  "rulesText": "On roll choose one:\n• Bank this die's pips.\n• [Discount 1] forge. Do not bank this die's pips.",
  "pips": {
    "mechanical": 2
  },
  "convertRoll": true,
  "onRoll": [
    {
      "type": "arm-forge-discount",
      "amount": 1
    }
  ],
  "onAbsorb": [],
  "maxOverloads": 2,
  "forgeRestriction": null
}
