{
  "$schema": "../schema/face.schema.json",
  "id": "face-synthetic-hexbrand",
  "name": "Hexbrand",
  "kind": "synthetic",
  "symbol": "corruption",
  "rulesText": "On roll: [Drain 1].\nOn absorb, once per turn: [Destroy Equipment].",
  "onRoll": [
    {
      "type": "drain-life",
      "amount": 1,
      "target": {
        "kind": "choose-enemy"
      },
      "with": {
        "kind": "choose-ally"
      }
    }
  ],
  "onAbsorb": [
    {
      "type": "destroy-equipment",
      "target": {
        "kind": "choose-enemy"
      }
    }
  ],
  "maxOverloads": 2,
  "forgeRestriction": null
}
