{
  "$schema": "../schema/face.schema.json",
  "id": "face-synthetic-aegis",
  "name": "Aegis",
  "kind": "synthetic",
  "symbol": "luminar",
  "rulesText": "On roll: [Generate 1 Shield].\nOn absorb: choose an allied creature; redirect up to 2 damage that would be dealt to another allied creature to that creature.",
  "onRoll": [
    {
      "type": "generate-symbol",
      "symbol": "shield",
      "amount": 1
    }
  ],
  "onAbsorb": [
    {
      "type": "arm-redirect-damage",
      "amount": 2,
      "target": {
        "kind": "choose-ally"
      }
    }
  ],
  "maxOverloads": 2,
  "forgeRestriction": null
}
