{
  "$schema": "../schema/face.schema.json",
  "id": "face-synthetic-sunward-lens",
  "name": "Sunward Lens",
  "kind": "synthetic",
  "symbol": "luminar",
  "rulesText": "On roll: this face also produces 1 Mechanical.",
  "pips": {
    "luminar": 1,
    "mechanical": 1
  },
  "onRoll": [],
  "onAbsorb": [],
  "maxOverloads": 2,
  "forgeRestriction": null
}
