{
  "$schema": "../schema/face.schema.json",
  "id": "face-synthetic-blade-rain",
  "name": "Blade Rain",
  "kind": "synthetic",
  "symbol": "wild",
  "rulesText": "On roll: you may distribute the damage of the next attack freely among enemies within [Range].",
  "onRoll": [
    {
      "type": "arm-blade-rain"
    }
  ],
  "onAbsorb": [],
  "maxOverloads": 3,
  "forgeRestriction": null
}
