{
  "$schema": "../schema/face.schema.json",
  "id": "face-synthetic-gore",
  "name": "Gore",
  "kind": "synthetic",
  "symbol": "wild",
  "rulesText": "On roll: [Strike 1].\nOn absorb, once per turn: [Empower 1].",
  "onRoll": [
    {
      "type": "damage",
      "amount": 1,
      "target": {
        "kind": "choose-enemy"
      }
    }
  ],
  "onAbsorb": [
    {
      "type": "next-attack-bonus",
      "amount": 1
    }
  ],
  "maxOverloads": 2,
  "forgeRestriction": null
}
