{
  "$schema": "../schema/face.schema.json",
  "id": "face-synthetic-command",
  "name": "Command",
  "kind": "synthetic",
  "symbol": "martial",
  "rulesText": "On roll: [Reposition].\nOn absorb, once per turn: [Strip 1 Shield].",
  "onRoll": [
    {
      "type": "reposition-creature",
      "target": {
        "kind": "choose-ally"
      }
    }
  ],
  "onAbsorb": [
    {
      "type": "remove-shield",
      "amount": 1,
      "target": {
        "kind": "most-shielded-enemy"
      }
    }
  ],
  "maxOverloads": 2,
  "forgeRestriction": null
}
